{
  "schemaVersion": "1.0.0",
  "candidateId": "CANDIDATE-0051",
  "userSlug": "grace-mar",
  "proposalClassCurrent": "SELF_KNOWLEDGE_ADD",
  "surfaceCurrent": "self_knowledge",
  "surfaceSuggested": "self_knowledge",
  "subsurfaceSuggested": null,
  "boundaryStatus": "clear",
  "misfiled": false,
  "why": [],
  "confidenceBand": "high",
  "confidenceScore": 0.85,
  "createdAt": "2026-05-02T14:29:13Z",
  "source": "recursion_gate_review",
  "proposalClassSuggested": "SELF_KNOWLEDGE_ADD",
  "artifactRelPath": "archive/queues/review-queue/boundary-classifications/CANDIDATE-0051.json"
}
