{
  "schemaVersion": "1.0.0",
  "candidateId": "CANDIDATE-0001",
  "userSlug": "perf-test-user",
  "proposalClassCurrent": "SELF_KNOWLEDGE_ADD",
  "surfaceCurrent": "self_knowledge",
  "surfaceSuggested": "self_knowledge",
  "subsurfaceSuggested": null,
  "boundaryStatus": "clear",
  "misfiled": false,
  "why": [],
  "confidenceBand": "high",
  "confidenceScore": 0.85,
  "createdAt": "2026-05-14T16:42:49Z",
  "source": "recursion_gate_review",
  "proposalClassSuggested": "SELF_KNOWLEDGE_ADD",
  "artifactRelPath": "review-queue/boundary-classifications/CANDIDATE-0001.json"
}
